April 10, 2014	H Con Res 96	Establishing the Budget for the United States Government for Fiscal Year 2015 and Setting Forth Appropriate Budgetary Levels for Fiscal Years 2016 Through 2024	Joint Resolution Passed - House(219 - 205)	Nay	
April 8, 2014	HR 1871	Baseline Reform Act of 2014	Bill Passed - House(230 - 185)	Nay	
April 4, 2014	HR 1874	Pro-Growth Budgeting Act of 2014	Bill Passed - House(224 - 182)	Nay	
April 3, 2014	HR 2575	Save American Workers Act of 2014	Bill Passed - House(248 - 179)	Nay	
March 26, 2014	HR 1459	Ensuring Public Involvement in the Creation of National Monuments Act	Bill Passed - House(222 - 201)	Nay	
March 25, 2014	HR 2824	Preventing Government Waste and Protecting Coal Mining Jobs in America	Bill Passed - House(229 - 192)	Nay	
March 14, 2014	HR 4015	SGR Repeal and Medicare Provider Payment Modernization Act of 2014	Bill Passed - House(238 - 181)	Nay	
March 13, 2014	HR 3189	Water Rights Protection Act	Bill Passed - House(238 - 174)	Nay	
March 13, 2014	HR 3973	Faithful Execution of the Law Act of 2014	Bill Passed - House(244 - 171)	Nay	
March 12, 2014	HR 4138	Executive Needs to Faithfully Observe and Respect Congressional Enactments of (ENFORCE) the Law Act of 2014	Bill Passed - House(233 - 181)	Nay	
March 6, 2014	H Amdt 585	Prohibits the Social Cost of Carbon from Being Included in Agency Determinations	Amendment Adopted - House(222 - 188)	Nay	
March 6, 2014	H Amdt 587	Exempts Certain Nuclear Facility Construction Projects from Environmental Review Time Frame Requirements	Amendment Rejected - House(187 - 220)	Yea	
March 6, 2014	HR 2641	Responsibly And Professionally Invigorating Development (RAPID) Act of 2013	Bill Passed - House(229 - 179)	Nay	
March 6, 2014	HR 3826	Electricity Security and Affordability Act	Bill Passed - House(229 - 183)	Nay	
March 5, 2014	HR 4118	Suspending the Individual Mandate Penalty Law Equals (SIMPLE) Fairness Act	Bill Passed - House(250 - 160)	Yea	
March 4, 2014	HR 3370	Homeowner Flood Insurance Affordability Act of 2014	Bill Passed - House(306 - 91)	Yea	
Feb. 27, 2014	H Amdt 561	Requires Agency Heads to File Negative-Impact Reports	Amendment Adopted - House(249 - 162)	Nay	
Feb. 27, 2014	HR 2804	Achieving Less Excess in Regulation and Requiring Transparency Act of 2014	Bill Passed - House(236 - 179)	Nay	
Feb. 27, 2014	HR 3193	Consumer Financial Protection Safety and Soundness Improvement Act of 2013	Bill Passed - House(232 - 182)	Nay	
Feb. 26, 2014	HR 3865	Stop Targeting of Political Beliefs by the IRS Act of 2014	Bill Passed - House(243 - 176)	Nay	
Feb. 25, 2014	HR 1123	Unlocking Consumer Choice and Wireless Competition Act	Bill Passed - House(295 - 114)	Nay	
Feb. 11, 2014	S 540	Temporary Debt Limit Extension Act	Bill Passed - House(221 - 201)	Yea	
Jan. 29, 2014	HR 2642	Federal Agriculture Reform and Risk Management Act of 2013	Conference Report Adopted - House(251 - 166)	Yea	
Jan. 28, 2014	HR 7	No Taxpayer Funding for Abortion Act	Bill Passed - House(227 - 188)	Nay	
Jan. 16, 2014	HR 3362	Exchange Information Disclosure Act	Bill Passed - House(259 - 154)	Yea	
Jan. 15, 2014	HR 3547	Consolidated Appropriations Act, 2014	Concurrence Vote Passed - House(359 - 67)	Yea	
Jan. 13, 2014	HR 3811	Health Exchange Security and Transparency Act of 2014	Bill Passed - House(291 - 122)	Yea	
Jan. 9, 2014	HR 2279	Reducing Excessive Deadline Obligations Act of 2014	Bill Passed - House(225 - 188)	Nay	
Dec. 12, 2013	H J Res 59	Continuing Appropriations Resolution, 2014	Concurrence Vote Passed - House(332 - 94)	Yea	
Dec. 11, 2013	HR 2019	Kids First Research Act of 2013	Bill Passed - House(295 - 103)	Yea	
Dec. 5, 2013	H Amdt 521	Authorizes Judicial Discretion in Awarding Legal Fees in Patent Lawsuits	Amendment Rejected - House(199 - 213)	Yea	
Dec. 5, 2013	H Amdt 524	Limits Covered Customers to Businesses With Less Than $25 Million in Revenue	Amendment Rejected - House(144 - 266)	Yea	
Dec. 5, 2013	HR 3309	Innovation Act	Bill Passed - House(325 - 91)	Nay	
Dec. 4, 2013	HR 1105	Small Business Capital Access and Job Preservation Act	Bill Passed - House(254 - 159)	Nay	
Nov. 21, 2013	H Amdt 512	Requires Natural Gas Pipeline Applications to Include Certain Information	Amendment Rejected - House(183 - 233)	Yea	
Nov. 21, 2013	H Amdt 513	Removes the Federal Energy Regulatory Commission Permit Issuance Requirement	Amendment Rejected - House(184 - 233)	Yea	
Nov. 21, 2013	H Amdt 515	Prohibits the Natural Gas Pipeline Permitting Reform Act from Taking Effect During the Sequester	Amendment Rejected - House(175 - 243)	Yea	
Nov. 21, 2013	HR 1900	Natural Gas Pipeline Permitting Reform Act	Bill Passed - House(252 - 165)	Nay	
Nov. 20, 2013	H Amdt 498	Specifies That Certain Fees Do Not Limit the Right to Petition	Amendment Rejected - House(199 - 222)	Yea	
Nov. 20, 2013	H Amdt 499	Authorizes the Secretary of the Interior to Require Certain Findings for Categorical Exclusions	Amendment Rejected - House(194 - 228)	Yea	
Nov. 20, 2013	H Amdt 503	Requires a Report on the Effect of Flooding on Oil and Gas Facilities	Amendment Rejected - House(202 - 221)	Yea	
Nov. 20, 2013	H Amdt 504	Appropriates $10 Million to the Commodity Futures Trading Commission	Amendment Rejected - House(195 - 226)	Yea	
Nov. 20, 2013	H Amdt 507	Specifies the Authority of the Secretary of Interior on the Regulation of Methane Emissions	Amendment Rejected - House(190 - 230)	Yea	
Nov. 20, 2013	HR 1965	Federal Lands Jobs and Energy Security Act	Bill Passed - House(228 - 192)	Nay	
Nov. 20, 2013	HR 2728	Protecting States' Rights to Promote American Energy Security Act	Bill Passed - House(235 - 187)	Nay	
Nov. 15, 2013	HR 3350	Keep Your Health Plan Act of 2013	Bill Passed - House(261 - 157)	Yea	
Nov. 14, 2013	HR 2655	Lawsuit Abuse Reduction Act of 2013	Bill Passed - House(228 - 195)	Nay	
Nov. 13, 2013	HR 982	Furthering Asbestos Claim Transparency (FACT) Act of 2013	Bill Passed - House(221 - 199)	Nay	
Oct. 30, 2013	H J Res 99	Disapproval of the President's Exercise of Authority to Suspend the Debt Limit	Joint Resolution Passed - House(222 - 191)	Nay	
Oct. 30, 2013	HR 992	Swaps Regulatory Improvement Act	Bill Passed - House(292 - 122)	Nay	
July 30, 2010	HR 5982	Tax Law Amendments	Bill Failed - House(241 - 154)	Yea	
July 30, 2010	HR 5987	Seniors Protection Act	House	Co-sponsor	
July 28, 2010	HR 5827	Exempting Guns from an Estate for Bankruptcy Purposes	Bill Passed - House(307 - 113)	Yea	
July 27, 2010	H Con Res 301	Directing the President to Remove Armed Forces from Pakistan	Joint Resolution Failed - House(38 - 372)	Did Not Vote	
July 27, 2010	HR 4899	Fiscal Year 2009-2010 Supplemental Appropriations	Concurrence Vote Passed - House(308 - 114)	Nay	
July 22, 2010	HR 4213	Unemployment Benefits Extension	Concurrence Vote Passed - House(272 - 152)	Yea	
July 21, 2010	HR 4380	Temporary Tariff Suspensions and Reductions	Bill Passed - House(378 - 43)	Yea	
July 21, 2010	HR 725	Tribal Law Enforcement Amendments	Concurrence Vote Passed - House(326 - 92)	Yea	
July 15, 2010	HR 5114	Flood Insurance Program Extension	Bill Passed - House(329 - 90)	Yea	
July 1, 2010	HR 4899	Limiting Afghanistan Military Funding to Withdrawal and Other Specified Purposes	Concurrence Vote Passed - House(239 - 182)	Yea	
July 1, 2010	HR 4899	Limiting Afghanistan Military Funding to Withdrawal and Other Specified Purposes	Concurrence Vote Failed - House(162 - 260)	Yea	
July 1, 2010	HR 4899	Limiting Afghanistan Military Funding to Withdrawal and Other Specified Purposes	Concurrence Vote Failed - House(100 - 321)	Nay	
July 1, 2010	HR 5618	Unemployment Benefits Extension	Bill Passed - House(270 - 153)	Yea	
July 1, 2010	H Res 1500	Deeming Supplemental Military Appropriations Passed and Allowing Divided Question	Bill Passed - House(215 - 210)	Nay	
June 30, 2010	HR 4173	Dodd-Frank Wall Street Reform and Consumer Protection Act	Conference Report Adopted - House(237 - 192)	Yea	
June 24, 2010	HR 5175	Campaign Finance Disclosure Requirements	Bill Passed - House(219 - 206)	Yea	
June 17, 2010	HR 5297	Small Business Lending Fund and Tax Law Amendments	Bill Passed - House(241 - 182)	Yea	
June 10, 2010	H Amdt 684	Increasing Minimum Down Payment for Federal Housing Administration Mortgages	Amendment Rejected - House(131 - 289)	Nay	
June 10, 2010	H Amdt 686	Limiting Federal Housing Administration Mortgage Issuance	Amendment Rejected - House(106 - 316)	Nay	
June 10, 2010	H Amdt 688	Limiting Principal Obligation Amounts of Federal Housing Administration Mortgages	Amendment Rejected - House(121 - 301)	Nay	
May 28, 2010	HR 4213	Unemployment Benefits Extension and Tax Law Amendments	Concurrence Vote Passed - House(215 - 204)	Yea	
May 28, 2010	HR 5116	Science and Technology Funding	Bill Passed - House(262 - 150)	Yea	
May 28, 2010	HR 5136	2010-2011 Defense Appropriation Authorizations	Bill Passed - House(229 - 186)	Yea	
May 27, 2010	H Amdt 661	Removing Funding for the F-35 Joint Strike Fighter's Alternate Engine Program	Amendment Rejected - House(193 - 231)	Nay	
May 27, 2010	H Amdt 672	Repealing "Don't Ask, Don't Tell" After Military Review and Certification	Amendment Adopted - House(234 - 194)	Yea	
May 19, 2010	HR 5325	Science and Technology Funding	Bill Failed - House(261 - 148)	Yea	
May 6, 2010	HR 1722	Telework Policies and Regulations for Federal Agencies	Bill Failed - House(268 - 147)	Yea	
April 29, 2010	HR 5175	Campaign Finance Disclosure Requirements	House	Co-sponsor	
April 27, 2010	HR 5146	Prohibiting 2010- 2011 Congressional Cost-of-Living Pay Increase	Bill Passed - House(402 - 15)	Yea	
April 22, 2010	HR 5116	Science and Technology Funding	House	Co-sponsor	
April 15, 2010	HR 4851	Unemployment Benefits Extension	Concurrence Vote Passed - House(289 - 112)	Yea	
March 25, 2010	HR 4872	Health Care Reconciliation Act	Concurrence Vote Passed - House(220 - 207)	Yea	
March 21, 2010	HR 3590	Patient Protection and Affordable Care Act	Concurrence Vote Passed - House(219 - 212)	Yea	
March 21, 2010	HR 4872	Health Care Reconciliation Act	Bill Passed - House(220 - 211)	Yea	
March 4, 2010	HR 2847	Employment, Infrastructure, and Transportation Appropriations and Tax Credits ("Senate Jobs Bill")	Concurrence Vote Passed - House(217 - 201)	Yea	
Feb. 26, 2010	HR 2701	Intelligence Authorization Act for Fiscal Year 2010	Bill Passed - House(235 - 168)	Yea	
Feb. 4, 2010	H J Res 45	Reinstating PAYGO Budget Rule	Motion Agreed - House(233 - 187)	Yea	
Dec. 16, 2009	HR 2847	Employment, Infrastructure, and Transportation Appropriations	Concurrence Vote Passed - House(217 - 212)	Yea	
Dec. 16, 2009	HR 4314	Increasing the National Public Debt Limit	Bill Passed - House(218 - 214)	Yea	
Dec. 11, 2009	HR 4173	Dodd-Frank Wall Street Reform and Consumer Protection Act	Bill Passed - House(223 - 202)	Yea	
Dec. 10, 2009	HR 3288	2009-2010 Omnibus Appropriations	Conference Report Adopted - House(221 - 202)	Yea	
Dec. 3, 2009	HR 4154	Estate Tax Law Amendments and Reinstatement of PAYGO	Bill Passed - House(225 - 200)	Yea	
Nov. 19, 2009	HR 3961	Revising Medicare Physician Fee Schedules and Reinstatement of PAYGO	Bill Passed - House(243 - 183)	Yea	
Nov. 7, 2009	H Amdt 509	Prohibiting Federally Funded Abortion Services	Amendment Adopted - House(240 - 194)	Nay	
Nov. 7, 2009	H Amdt 510	Substitute Health Care and Insurance Law Amendments	Amendment Rejected - House(176 - 258)	Nay	
Nov. 7, 2009	HR 3962	Health Care and Insurance Law Amendments	Bill Passed - House(220 - 215)	Yea	
Nov. 5, 2009	HR 3548	Extending Federal Emergency Unemployment Benefits and Providing Business and Homebuyer Tax Credits	Concurrence Vote Passed - House(403 - 12)	Yea	
Oct. 29, 2009	HR 2996	Continuing Appropriations Extension and 2009-2010 Department of Interior, Environmental Protection Agency, and Related Appropriations	Conference Report Adopted - House(247 - 178)	Yea	
Oct. 15, 2009	HR 2892	2009-2010 Department of Homeland Security Appropriations Authorizations	Conference Report Adopted - House(307 - 114)	Yea	
Oct. 8, 2009	HR 2647	2009-2010 Defense Appropriations	Conference Report Adopted - House(281 - 146)	Yea	
Dec. 4, 2014	HR 5759	Preventing Executive Overreach on Immigration Act of 2014	Bill Passed - House(219 - 197)	Nay	
Nov. 19, 2014	HR 4012	Secret Science Reform Act of 2014	Bill Passed - House(237 - 190)	Nay	
Nov. 18, 2014	HR 1422	EPA Science Advisory Board Reform Act of 2013	Bill Passed - House(229 - 191)	Nay	
Nov. 14, 2014	HR 5682	To Approve the Keystone XL Pipeline	Bill Passed - House(252 - 161)	Nay	
Sept. 17, 2014	H Amdt 1141	Authorizes Aid to Syrian Opposition	Amendment Adopted - House(273 - 156)	Nay	
Sept. 17, 2014	H J Res 124	Continuing Appropriations Resolution, 2015	Joint Resolution Passed - House(319 - 108)	Yea	
Sept. 11, 2014	HR 3522	Employee Health Care Protection Act of 2013	Bill Passed - House(247 - 167)	Nay	
Sept. 9, 2014	HR 5078	Waters of the United States Regulatory Overreach Protection Act of 2014	Bill Passed - House(262 - 152)	Nay	
Sept. 9, 2014	H Res 644	Condemning and Disapproving of the Failure of the Obama Administration to Comply with the Lawful Statutory Requirement to Notify Congress before Transferring Individuals Detained at United States Naval Station, Guantanamo Bay, Cuba, and Expressing Concern About the National Security Risks Over the Transfer of Five Taliban Leaders and the Repercussions of Negotiating with Terrorists	Resolution Passed - House(249 - 163)	Nay	
Aug. 1, 2014	HR 5230	Making Supplemental Appropriations for the Fiscal Year Ending September 30, 2014, and for Other Purposes	Bill Passed - House(223 - 189)	Nay	
Aug. 1, 2014	HR 5272	To Prohibit Certain Actions with Respect to Deferred Action for Aliens Not Lawfully Present in the United States, and for Other Purposes	Bill Passed - House(216 - 192)	Nay	
July 30, 2014	H Res 676	Providing for Authority to Initiate Litigation for Actions by the President or Other Executive Branch Officials Inconsistent with Their Duties Under the Constitution of the United States	Resolution Passed - House(225 - 201)	Nay	
July 16, 2014	H Amdt 1079	Prohibits the Internal Revenue Service (IRS) from Providing Bonuses to Employees	Amendment Adopted - House(282 - 138)	Yea	
July 16, 2014	H Amdt 1083	Prohibits Federal Agencies from Paying Federal Employees Certain Pay Rates	Amendment Rejected - House(193 - 230)	Yea	
July 16, 2014	H Amdt 1086	Prohibits States from Penalizing a Bank for Providing Financial Services to Marijuana Businesses	Amendment Adopted - House(231 - 192)	Yea	
July 16, 2014	H Amdt 1093	Prohibits Federal Communications Commission (FCC) from Preventing States from Implementing Broadband Internet Access Service Laws	Amendment Adopted - House(223 - 200)	Nay	
July 16, 2014	H Amdt 1098	Prohibits District of Columbia from Implementing Certain Firearm Laws	Amendment Adopted - House(241 - 181)	Nay	
July 16, 2014	HR 5016	Financial Services and General Government Appropriations Act, 2015	Bill Passed - House(228 - 195)	Nay	
July 15, 2014	HR 5021	Highway and Transportation Funding Act of 2014 	Bill Passed - House(367 - 55)	Yea	
July 10, 2014	H Amdt 1012	Prohibits Federal Agencies from Contracting with Businesses Chartered in Bermuda or in the Cayman Islands	Amendment Adopted - House(221 - 200)	Yea	
July 10, 2014	H Amdt 1040	Prohibits Implementation of Certain Climate Assessments	Amendment Adopted - House(229 - 188)	Nay	
June 26, 2014	HR 4899	Lowering Gasoline Prices to Fuel an America That Works Act of 2014	Bill Passed - House(229 - 185)	Nay	
June 24, 2014	H Amdt 956	Prohibits Pending Pipeline Permit Applications from Receiving Automatic Approval	Amendment Rejected - House(171 - 240)	Yea	
June 24, 2014	HR 3301	North American Energy Infrastructure Act	Bill Passed - House(238 - 173)	Nay	
June 19, 2014	H Amdt 901	Prohibits Transfer of Guantanamo Bay Detainees to Yemen	Amendment Adopted - House(238 - 179)	Nay	
June 19, 2014	H Amdt 905	Prohibits Transfer of Guantanamo Bay Detainees to Any Foreign Country	Amendment Adopted - House(230 - 184)	Nay	
June 19, 2014	H Amdt 907	Repeals Prohibition on Guantanamo Bay Detainee Transfers and Facility Construction	Amendment Rejected - House(163 - 249)	Nay	
June 19, 2014	H Amdt 908	Prohibits United States Combat Operations in Iraq	Amendment Rejected - House(165 - 250)	Yea	
June 19, 2014	H Amdt 912	Prohibits Funds from Being Used Pursuant to the Authorization for Use of Military Force Against Iraq Resolution of 2002	Amendment Rejected - House(182 - 231)	Yea	
June 19, 2014	H Amdt 917	Prohibits United States from Providing Weapons in Syria	Amendment Rejected - House(167 - 244)	Nay	
June 19, 2014	H Amdt 935	Prohibits a Federal Employee from Requesting Foreign Intelligence Information in Relation to a US Citizen	Amendment Adopted - House(293 - 123)	Yea	
June 10, 2014	H Amdt 813	Prohibits Funds from Being Used to Implement a Department of Housing and Urban Development Plan	Amendment Adopted - House(219 - 207)	Nay	
June 10, 2014	H Amdt 815	Prohibits Funds from Being Used to Acquire Traffic Cameras	Amendment Adopted - House(255 - 171)	Nay	
June 10, 2014	H Amdt 823	Prohibits Funds from Being Used for the California High-Speed Rail	Amendment Adopted - House(227 - 186)	Nay	
June 10, 2014	HR 4745	Transportation, Housing and Urban Development, and Related Agencies Appropriations Act, 2015	Bill Passed - House(229 - 192)	Nay	
June 9, 2014	H Amdt 783	Reduces Appropriations to Amtrak	Amendment Rejected - House(154 - 248)	Nay	
May 30, 2014	H Amdt 738	Authorizes Funds to be Used for Guantanamo Bay Operations	Amendment Rejected - House(169 - 230)	Nay	
May 30, 2014	H Amdt 748	Prohibits Federal Agencies from Preventing States from Authorizing the Use of Medical Marijuana	Amendment Adopted - House(219 - 189)	Yea	
May 30, 2014	H Amdt 750	Prohibits Funds from Being Used for the Transfer of Clemency Application Screening Personnel	Amendment Adopted - House(219 - 189)	Nay	
May 30, 2014	H Amdt 763	Prohibits Funds from Being Used to Require Journalists to Disclose Sources	Amendment Adopted - House(225 - 183)	Yea	
May 22, 2014	H Amdt 671	Prohibits Funds from Being Used for Certain Climate Change Reports	Amendment Adopted - House(231 - 192)	Nay	
May 22, 2014	H Amdt 675	Prohibits Funds from Being Used for Guantanmo Bay Operations	Amendment Rejected - House(177 - 247)	Nay	
May 22, 2014	H Amdt 676	Repeals Indefinite Military Detention Provisions	Amendment Rejected - House(191 - 230)	Yea	
May 22, 2014	H Amdt 679	Prohibits Funds from Being Used to Implement the New START Treaty	Amendment Adopted - House(233 - 191)	Nay	
May 22, 2014	H Amdt 680	Repeals Military Force Authorization	Amendment Rejected - House(191 - 233)	Yea	
May 22, 2014	HR 3361	USA FREEDOM Act	Bill Passed - House(303 - 121)	Nay	
May 22, 2014	HR 4435	Howard P. "Buck" McKeon National Defense Authorization Act for Fiscal Year 2015	Bill Passed - House(325 - 98)	Yea	
May 21, 2014	H Amdt 669	Amends Intercontinental-Range Ballistic Missiles (ICBM) Laws	Amendment Adopted - House(222 - 196)	Nay	
May 9, 2014	HR 4438	American Research and Competitiveness Act of 2014	Bill Passed - House(274 - 131)	Yea	
May 7, 2014	H Res 574	Recommends that the House of Representatives Find Lois G. Lerner in Contempt of Congress	Resolution Passed - House(231 - 187)	Nay	
May 23, 2013	HR 1911	Smarter Solutions for Students Act	Bill Passed - House(221 - 198)	Nay	
May 22, 2013	H Amdt 67	Requires a Finding be Added Concerning Oil Sand Crudes	Amendment Rejected - House(146 - 269)	Yea	
May 22, 2013	H Amdt 69	Requires Threat Assessment of Pipeline Vulnerabilities to a Terrorist Attack	Amendment Rejected - House(176 - 239)	Yea	
May 22, 2013	H Amdt 71	Repeals Requirement that Secretary of the Army Approve All Keystone XL Pipeline Permit Applications	Amendment Rejected - House(182 - 234)	Yea	
May 22, 2013	H Amdt 72	Increases Time to File a Claim Under the Northern Route Approval Act from 60 Days to 1 Year	Amendment Rejected - House(182 - 234)	Yea	
May 22, 2013	H Amdt 75	Requires All Oil and Refined Fuels Transported Through the Keystone XL Pipeline to be Used Only in The United States	Amendment Rejected - House(162 - 255)	Yea	
May 22, 2013	HR 3	Northern Route Approval Act	Bill Passed - House(241 - 175)	Nay	
May 17, 2013	HR 1062	SEC Regulatory Accountability Act	Bill Passed - House(235 - 161)	Nay	
May 16, 2013	HR 45	Repeals the Patient Protection and Affordable Care Act and Health Care-Related Provisions in the Health Care and Education Reconciliation Act of 2010	Bill Passed - House(229 - 195)	Nay	
May 9, 2013	HR 807	Full Faith and Credit Act	Bill Passed - House(221 - 207)	Nay	
May 8, 2013	HR 1406	Working Families Flexibility Act of 2013	Bill Passed - House(223 - 204)	Nay	
April 18, 2013	HR 624	Cyber Intelligence Sharing and Protection Act	Bill Passed - House(288 - 127)	Did Not Vote	
April 15, 2013	HR 249	Federal Employee Tax Accountability Act of 2013	Bill Failed - House(250 - 159)	Nay	
April 12, 2013	HR 1120	Preventing Greater Uncertainty in Labor-Management Relations Act	Bill Passed - House(219 - 209)	Nay	
March 21, 2013	H Con Res 25	Establishing the Budget for the United States Government for Fiscal Year 2014 and Setting Forth Appropriate Budgetary Levels for Fiscal Years 2015 Through 2023	Joint Resolution Passed - House(221 - 207)	Nay	
March 21, 2013	HR 933	Consolidated and Further Continuing Appropriations Act, 2013	Concurrence Vote Passed - House(318 - 109)	Yea	
March 15, 2013	HR 803	Supporting Knowledge and Investing in Lifelong Skills Act (SKILLS Act)	Bill Passed - House(215 - 202)	Nay	
March 13, 2013	HR 890	Preserving Work Requirements for Welfare Programs Act of 2013	Bill Passed - House(246 - 181)	Nay	
March 6, 2013	HR 933	Consolidated and Further Continuing Appropriations Act, 2013	Bill Passed - House(267 - 151)	Nay	
Feb. 28, 2013	H Amdt 23	Reauthorizes the Violence Against Women Act	Amendment Rejected - House(166 - 257)	Nay	
Feb. 28, 2013	S 47	Violence Against Women Reauthorization Act of 2013	Bill Passed - House(286 - 138)	Yea	
Feb. 15, 2013	HR 273	Eliminates the 2013 Statutory Pay Adjustment for Federal Employees	Bill Passed - House(261 - 154)	Nay	
Jan. 23, 2013	HR 325	No Budget, No Pay Act of 2013	Bill Passed - House(285 - 144)	Nay	
Jan. 15, 2013	H Amdt 4	Offsets Cost of Disaster Relief Appropriations Through Discretionary Budget Cuts	Amendment Rejected - House(162 - 258)	Nay	
Jan. 15, 2013	HR 152	Disaster Relief Appropriations Act, 2013	Bill Passed - House(241 - 180)	Yea	
Dec. 22, 2010	HR 847	9/11 Health and Compensation Act	Concurrence Vote Passed - House(206 - 60)	Yea	
Dec. 21, 2010	HR 2751	FDA Food Safety Modernization Act	Concurrence Vote Passed - House(215 - 144)	Yea	
Dec. 21, 2010	HR 3082	Continuing Appropriations	Concurrence Vote Passed - House(193 - 165)	Yea	
Dec. 17, 2010	HR 4853	Temporary Extension of Tax Relief	Concurrence Vote Passed - House(277 - 148)	Nay	
Dec. 17, 2010	HR 5510	Aiding Those Facing Foreclosure Act	Bill Failed - House(210 - 145)	Yea	
Dec. 16, 2010	H Amdt 786	Amending the Estate Tax	Amendment Rejected - House(194 - 233)	Yea	
Dec. 15, 2010	HR 2965	Don't Ask, Don't Tell Repeal Act	Concurrence Vote Passed - House(250 - 175)	Yea	
Dec. 8, 2010	HR 5281	DREAM Act	Concurrence Vote Passed - House(216 - 198)	Yea	
Dec. 8, 2010	HR 5987	Seniors Protection Act	Bill Failed - House(254 - 153)	Yea	
Dec. 8, 2010	HR 6495	Mine Safety Act	Bill Failed - House(214 - 193)	Yea	
Dec. 2, 2010	HR 4853	Temporary Extension of Tax Relief	Concurrence Vote Passed - House(234 - 188)	Yea	
Dec. 2, 2010	H Res 1737	Censure for Representative Charles Rangel	Resolution Passed - House(333 - 79)	Yea	
Nov. 18, 2010	HR 1722	Telework Policies and Regulations for Federal Agencies	Concurrence Vote Passed - House(254 - 152)	Yea	
Nov. 18, 2010	HR 6419	Extension of Certain Unemployment Benefits	Bill Failed - House(258 - 154)	Yea	
Nov. 17, 2010	HR 3808	Interstate Recognition of Notarizations Act of 2010 2	Veto Override Failed - House(185 - 235)	Nay	
Sept. 30, 2010	HR 3081	Continuing Appropriations	Concurrence Vote Passed - House(228 - 194)	Yea	
Sept. 23, 2010	HR 4823	Establishing Sedona-Red Rock National Scenic Area	Bill Failed - House(258 - 160)	Yea	
Sept. 23, 2010	HR 5110	Expanding Casa Grande Ruins National Monument	Bill Failed - House(244 - 174)	Yea	
Sept. 23, 2010	HR 5297	Small Business Lending Fund and Tax Law Amendments	Concurrence Vote Passed - House(237 - 187)	Yea	
Sept. 22, 2010	HR 3470	Infant Mortality Pilot Programs	Bill Passed - House(324 - 64)	Did Not Vote	
Sept. 16, 2010	HR 4785	Authorizing Loans for Energy Efficiency Purposes	Bill Passed - House(240 - 172)	Did Not Vote	
Aug. 10, 2010	HR 1586	Aid To States for Medicaid, Teacher Employment, and Other Purposes	Concurrence Vote Passed - House(247 - 161)	Yea	
July 30, 2010	H Amdt 773	Ending Moratorium on Deepwater Drilling Rigs that Meet Certain Safety Standards	Amendment Adopted - House(216 - 195)	Nay	
July 30, 2010	HR 3534	Offshore Drilling Regulations and Other Energy Law Amendments	Bill Passed - House(209 - 193)	Yea	
July 30, 2010	HR 5851	"Whistleblower Protection" for Offshore Oil Workers	Bill Passed - House(315 - 93)	Yea	
Oct. 29, 2013	HR 2374	Retail Investor Protection Act	Bill Passed - House(254 - 166)	Nay	
Oct. 29, 2013	HR 3361	USA FREEDOM Act	House	Co-sponsor	
Oct. 29, 2013	HR 3370	Homeowner Flood Insurance Affordability Act of 2014	House	Co-sponsor	
Oct. 16, 2013	HR 2775	Continuing Appropriations Resolution, 2014	Concurrence Vote Passed - House(285 - 144)	Yea	
Oct. 11, 2013	H J Res 76	National Nuclear Security Administration Continuing Appropriations Resolution, 2014	Bill Passed - House(248 - 176)	Nay	
Oct. 10, 2013	H J Res 79	Border Security and Enforcement Continuing Appropriations Resolution, 2014	Joint Resolution Passed - House(249 - 175)	Nay	
Oct. 9, 2013	H J Res 90	Federal Aviation Administration Continuing Appropriations Resolution, 2014	Joint Resolution Passed - House(252 - 172)	Nay	
Oct. 8, 2013	H J Res 84	Head Start Continuing Appropriations Resolution, 2014	Joint Resolution Passed - House(248 - 168)	Nay	
Oct. 7, 2013	H J Res 77	Food and Drug Administration Continuing Appropriations Resolution, 2014	Joint Resolution Passed - House(235 - 162)	Nay	
